Name,Description-EN,Description-FR,Tag,Tag,Tag,Tag,Tag,Tag,Tag,Tag,Tag,Tag,Tag,Tag,Tag,Tag,Tag,Tag,Tag,Tag,Tag,Provider,Provider,Provider,Provider,Provider,Uses,Uses,UsedBy,UsedBy,UsedBy,UsedBy,InteroperableWith,userType,userSize,Partof,Start,Official website,EmailContact,Demo,Logo,Logo,Screenshot,Screenshot,Language,Language,Language,Language,Language,Language,Language,Language,Language,Language,Language,Language,Language,Language,Language,Language,Language,Language,Language,Language,Language,Language,Language,Language,Language,Language,Language,Language,Client,Client,Client,Client,Client,Client,Client,twitter,facebook,youtube,vimeo,dailymotion,forum,help,TOS,Privacy policy,pricingModel,wikipedia-EN,wikipedia-FR,wikidata,wikidata,wikidata,accessibility,moderationSystem,scoreInstallation,scoreUse
Appgree,"Appgree finds the ideas a community agrees on the most, making a group conversation possible",,Deliberation,-General Purpose,Voting,Decision-making,Proposition,Polling,Q&A,Community organizing,,,,,,,,,,,,Appgree,,,,,,,Appgree Podemos [usage],Guanyem Barcelona,,,,,,,,http://www.appgree.com/,support@appgree.com,,,,,,EN,ES,PT,,,,,,,,,,,,,,,,,,,,,,,,,,Web https://app.appgree.com/,Android https://play.google.com/store/apps/details?id=com.mooncasttv.app.appgree,iOS https://itunes.apple.com/bm/app/appgree/id606270279,,,,,http://www.twitter.com/appgree,https://www.facebook.com/appgree,https://www.youtube.com/user/appgree,https://vimeo.com/appgree/videos,,,http://www.appgree.com/appgree/en/help/,http://www.appgree.com/appgree/en/app-terms-use/,http://www.appgree.com/appgree/en/web-privacy-policy/,,,,,,,,,,
BSD Tools,A suite of integrated features that work together to help you mobilize a community and drive real action.,,Fundraising,Communication,Advocacy,Analysis,Donations,Campaign management,Constituency,Email,Content management system (CMS),Social networking,Community organizing,Pol-Tech,Campaign,Suite,,,,,,Blue State Digital,,,,,,,,,,,,,,,,http://www.bsdtools.com,toolsinfo@bluestatedigital.com,http://info.bluestatedigital.com/tools-demo-request,,,,,EN,,,,,,,,,,,,,,,,,,,,,,,,,,,,Web,,,,,,,,,,,,,http://tools.bluestatedigital.com/kb,http://tools.bluestatedigital.com/pages/bsd-terms-and-conditions,http://tools.bluestatedigital.com/kb/policies,,https://en.wikipedia.org/wiki/Blue_State_Digital#Services,,,,,,,,
Cinquante Plus Un,"Cinquante Plus Un is a new online technology for cutting-edge field campaign. Target priority polling stations, edit walk lists for your volunteers and follow your progress day by day. You can also manage and energize your contact base to keep voters and activists connected to your campaign. ","Logiciel en ligne de campagne électorale, de pilotage politique et d’optimisation du porte-à-porte",Canvassing,Pol-Tech,Map,Data mining,Campaign management,Calendar,Customer relationship management (CRM),Strategy,,,,,,,,,,,,Liegey Muller Pons,,,,,,,,,,,,,,,,http://www.cinquanteplusun.com/,,http://www.liegeymullerpons.fr/cinquante-plus-un-pour-votre-circonscription/,,,,,FR,,,,,,,,,,,,,,,,,,,,,,,,,,,,Web,,,,,,,,,,,,,,,,,,,,,,,,,
DigitaleBox,"DigitaleBox is the Social Media Management & Community Organizing Software. The solution enables to easily manage social media activity, to manage targeted Communications campaign through Emailing, private messaging and SMS, to organize on line communities in a unique data base. ","DigitaleBox est un logiciel de gestion des réseaux sociaux et d'organisation de communautés. La solution permet de gérer et d'animer les communautés sur les réseaux sociaux, de gérer les communications ciblées et de masse par emailing, messagerie privées ou SMS, d'organiser une communauté en ligne dans une base de données unique.",Customer relationship management (CRM),Bulk messaging,Pol-Tech,Content management system (CMS),Publishing,Emailing,Social networking,,,,,,,,,,,,,DigitaleBox SASU,,,,,,,,,,,,,,,,http://digitalebox.fr/,,,,,,,FR,EN,,,,,,,,,,,,,,,,,,,,,,,,,,,Web,,,,,,,https://twitter.com/DigitaleBox,https://www.facebook.com/digitalebox,https://www.youtube.com/channel/UC5nZNjkNNSJEztUvMIgpzzA,,,,,,,Pay as you grow,,,,,,,,,
Doodle,"Simple scheduling tool, for time management and coordinating meetings.",,-General Purpose,Mobilizing,Scheduling & Calendar Sharing,Scheduling,Poll,Meeting,Date,Online service,Cloud,Meeting,,,,,,,,,,Doodle AG,,,,,,,,,,,,,,,2007,http://doodle.com/,contact@doodle.com,,,,,,EN,FR,ES,DE,IT,,,,,,,,,,,,,,,,,,,,,,,,Web,Android https://play.google.com/store/apps/details?id=com.doodle.android,iOS http://itunes.apple.com/app/doodle-schedule-maker/id938182547,,,,,,,,,,,https://doodle.com/help,https://doodle.com/terms-of-service,https://doodle.com/privacy-policy,"Free plan, commercial plans https://doodle.com/premium",https://en.wikipedia.org/wiki/Doodle.com,https://fr.wikipedia.org/wiki/Doodle.com,,,,,,,
Dropbox,"Dropbox lets you bring all your photos, docs and videos anywhere. Any file you save to your Dropbox will automatically save to all your computers, phones, and the Dropbox website. Dropbox works hard to make sure that all your files are the same no matter where you’re working from. You can start working on a computer at school or the office, and finish from your home computer. Never email yourself a file again! Dropbox also makes it easy to share with others. Invite your friends, family, and teammates to any folder in your Dropbox, and it’ll be as if you saved that folder straight to their computers.",,-File Sharing & Collaborative Writing,-application,-client,-cloud computing,-file hosting service,Online service,Cloud,File,Hosting,Storage,Synchronization,Sharing,,,,,,,,Dropbox Inc.,,,,,,,,,,,,,,,2007,https://www.dropbox.com/,,,http://commons.wikimedia.org/wiki/Special:FilePath/Dropbox%20logo%202015.svg,,,,EN,FR,ES,DE,,,,,,,,,,,,,,,,,,,,,,,,,Web,Android,BlackBerry OS,Linux,iOS,Windows,Symbian,https://twitter.com/Dropbox,https://www.facebook.com/Dropbox/,,,,,https://www.dropbox.com/help,https://www.dropbox.com/privacy#terms,https://www.dropbox.com/privacy,"Free plan, commercial plans",https://en.wikipedia.org/wiki/Dropbox%20%28service%29,,http://www.wikidata.org/entity/Q142539,,,,,,
Eventbrite,Eventbrite is the world’s largest self-service ticketing platform. It offers a simple way promote public events and manage RSVPs for events where space may be limited.,,Conference Management,Event organizing,Management,Planning,Events,Ticketing,Ticket saling,Workshop,Registration,Meeting,Booking,Campaign,Community,Organization,Engagement,,,,,"Eventbrite, Inc.",,,,,,,,,,,,,,,2006,https://www.eventbrite.com/,,,,,,,EN,DE,FR,ES,NL,IT,PT,SV,,,,,,,,,,,,,,,,,,,,,Web,,,,,,,https://www.twitter.com/Eventbrite,https://www.facebook.com/Eventbrite,,,,,https://www.eventbrite.com/support,https://www.eventbrite.com/tos,https://www.eventbrite.com/privacypolicy,https://www.eventbrite.com/fees/,https://en.wikipedia.org/wiki/Eventbrite,,,,,,,,
Facebook,Facebook is a global social networking website.,,Social Networking & Online Community,Social media,social networking service,,,,,,,,,,,,,,,,,"Facebook, Inc.",,,,,,,,,,,,,,,2004-02-04T00:00:00Z,https://www.facebook.com,,,http://commons.wikimedia.org/wiki/Special:FilePath/Facebook.svg,,http://commons.wikimedia.org/wiki/Special:FilePath/Facebook%20Headquarters%20Entrance%20Sign%20Menlo%20Park.jpg,,EN,FR,ES,DE,,,,,,,,,,,,,,,,,,,,,,,,,Web,,,,,,,https://www.twitter.com/facebook,,,,,,,https://www.facebook.com/terms,,,https://en.wikipedia.org/wiki/Facebook,,http://www.wikidata.org/entity/Q355,,,,,,
Fluicity,"Fluicity is a web platform & app that allows personalized information, efficient interaction facilitating the relationship between the citizen and their representatives.","Fluicity est un réseau citoyen de communautés locales. Notre ambition : fédérer des communautés de citoyens engagés et définir un nouveau standard de gouvernance, pour les villes intelligentes. Le réseau est constitué de communautés locales autonomes, et permettant à tout citoyen de participer à l'amélioration de son territoire, et à tout responsable public d'adapter ses décisions en fonction des habitants.",Crowdsourcing,Community,Local news,Local,Events,Polling,Ideation,Citizen-government dialogue,Social networking,Smart city,Transparency,Participatory budget,Crowdfunding,Empowerment,Online service,,,,,Fluicity SAS,,,,,,,,,,,,,,,,https://www.flui.city/,,https://www.flui.city/demo,,,,,FR,,,,,,,,,,,,,,,,,,,,,,,,,,,,Web,,,,,,,https://twitter.com/fluicities,https://www.facebook.com/fluicity/,https://www.youtube.com/user/judepim1,,,,,https://www.flui.city/cgu,https://www.flui.city/dataprivacy,Custom pricing,,,,,,,,,
GitHub,"GitHub is a web-based Git repository hosting service, which offers all of the distributed revision control and source code management functionality of Git as well as adding its own features. Unlike Git, which is strictly a command-line tool, GitHub provides a web-based graphical interface and desktop as well as mobile integration. It also provides access control and several collaboration features such as wikis, task management, and bug tracking and feature requests for every project.",,Collaborative document writing,-shared web hosting service,Forge,Repository,Versioning,Development,Software development,Social networking,Wiki,Issue tracking,,,,,,,,,,"GitHub, Inc.",,,,,,,,,,,,,,,2008-02-08,https://github.com,,,http://commons.wikimedia.org/wiki/Special:FilePath/GitHub%20logo%202013.svg,,,,EN,,,,,,,,,,,,,,,,,,,,,,,,,,,,Web,,,,,,,https://www.twitter.com/github,,,,,,,https://help.github.com/articles/github-terms-of-service/,,,https://en.wikipedia.org/wiki/GitHub,,http://www.wikidata.org/entity/Q364,,,,,,
Gmail,Email service,,online service,Cloud,Email,Communication,Instant messaging,,,,,,,,,,,,,,,Google Inc.,,,,,,,,,,,,,,,2004-04-01T00:00:00Z,https://gmail.com/,,,http://commons.wikimedia.org/wiki/Special:FilePath/Gmail%20Icon.png,,,,EN,FR,ES,DE,,,,,,,,,,,,,,,,,,,,,,,,,Web,Android,iOS,,,,,https://www.twitter.com/gmail,,,,,,https://support.google.com/mail/,https://www.google.com/policies/terms/,https://www.google.com/policies/privacy/,,https://en.wikipedia.org/wiki/Gmail,,http://www.wikidata.org/entity/Q9334,,,,,,
Google Docs,Collaborative document writing solution from Google.,,-Collaborative document writing,-cloud computing,-file hosting service,-office suite,Text,Editor,,,,,,,,,,,,,,Google Inc.,,,,,,,,,,,,,,,2007,https://docs.google.com/document/,,,,,,,EN,FR,ES,DE,,,,,,,,,,,,,,,,,,,,,,,,,Web,Android,iOS,,,,,,,,,,,https://support.google.com/docs/,https://www.google.com/policies/terms/,https://www.google.com/policies/privacy/,,"https://en.wikipedia.org/wiki/Google_Docs,_Sheets,_Slides_and_Forms",,http://www.wikidata.org/entity/Q9344,,,,,,
Google Drive,"Google Drive lets you store and access your files anywhere—on the web, on your hard drive, or on the go. Here’s how it works: go to Google Drive on the web at drive.google.com; install Google Drive on your computer or mobile device; throw your files in Google Drive, and it’s right there on your device. Now your files go everywhere you do. [If you] change a file on the web, on your computer, or on your mobile device, it updates on every device where you’ve installed Google Drive.",,-File Sharing & Collaborative Writing,-application,-cloud storage,-website,Online service,Cloud,File,Hosting,Storage,Synchronization,Sharing,,,,,,,,,Google Inc.,,,,,,,,,,,,,,,2012-04-12,https://www.google.com/drive/,,,http://commons.wikimedia.org/wiki/Special:FilePath/Google%20Drive%20logo.png,,,,EN,FR,ES,DE,,,,,,,,,,,,,,,,,,,,,,,,,Web,Android,iOS,,,,,,,,,,,https://support.google.com/drive/,https://www.google.com/policies/terms/,https://www.google.com/policies/privacy/,"Free plan, commercial plans",https://en.wikipedia.org/wiki/Google%20Drive,,http://www.wikidata.org/entity/Q9340,,,,,,
Google Forms,,,Form,Polling,,,,,,,,,,,,,,,,,,Google Inc.,,,,,,,,,,,,,,,,,,,,,,,EN,FR,ES,DE,,,,,,,,,,,,,,,,,,,,,,,,,Web,,,,,,,,,,,,,https://support.google.com/docs/,https://www.google.com/policies/terms/,https://www.google.com/policies/privacy/,,"https://en.wikipedia.org/wiki/Google_Docs,_Sheets,_Slides_and_Forms",,,,,,,,
Google Groups,,,Group communication tools,Forum,Mailing list,Group,,,,,,,,,,,,,,,,Google Inc.,,,,,,,,,,,,,,,,,,,,,,,EN,FR,ES,DE,,,,,,,,,,,,,,,,,,,,,,,,,Web,,,,,,,,,,,,,https://support.google.com/groups/,https://www.google.com/policies/terms/,https://www.google.com/policies/privacy/,,,,,,,,,,
Google Maps,Google Maps is a basic web mapping service application and technology that powers many map-based services.,,digital map,mobile app,-software,web application,website,Mapping,Cloud,Online service,Map,,,,,,,,,,,Google,,,,,,,,,,,,,,,2005-02-08,https://maps.google.com,,,,,http://commons.wikimedia.org/wiki/Special:FilePath/Google%20Street%20View%20camera%20cars%20in%20Gorz%C3%B3w%20Wielkopolski%2002.JPG,,EN,FR,ES,DE,,,,,,,,,,,,,,,,,,,,,,,,,Web,Android,iOS,,,,,,,https://www.youtube.com/channel/UCnIQPPwWpO_EFEqLny6TFTw,,,,https://support.google.com/maps/,https://www.google.com/policies/terms/,https://www.google.com/policies/privacy/,"Free plan, commercial plans",https://en.wikipedia.org/wiki/Google%20Maps,,http://www.wikidata.org/entity/Q12013,http://www.wikidata.org/entity/Q4558504,,,,,
Google Sheets,"Collaborative, web-based spreadsheet application.",,-Crowdsourced data collection,Data,Spreadsheet,Crowdsourcing,Calculation,Collaborative,,,,,,,,,,,,,,Google Inc.,,,,,,,,,,,,,,,2007,https://docs.google.com/spreadsheets/,,,,,,,EN,FR,ES,DE,,,,,,,,,,,,,,,,,,,,,,,,,Web,Android,iOS,,,,,,,,,,,https://support.google.com/docs/,https://www.google.com/policies/terms/,https://www.google.com/policies/privacy/,"Free plan, commercial plans","https://en.wikipedia.org/wiki/Google_Docs,_Sheets,_Slides_and_Forms",,,,,,,,
Google Slides,,,Presentation,Slide,,,,,,,,,,,,,,,,,,Google Inc.,,,,,,,,,,,,,,,2007,https://docs.google.com/presentation,,,,,,,EN,FR,ES,DE,,,,,,,,,,,,,,,,,,,,,,,,,Web,,,,,,,,,,,,,https://support.google.com/docs/,https://www.google.com/policies/terms/,https://www.google.com/policies/privacy/,,"https://en.wikipedia.org/wiki/Google_Docs,_Sheets,_Slides_and_Forms",,,,,,,,
Google+,Google+ (pronounced and sometimes written as Google Plus) is an interest-based social network.,,Social networking,Identity,Marketing,Communication,,,,,,,,,,,,,,,,Google Inc.,,,,,,,,,,,,,,,2011-06-28T00:00:00Z,https://plus.google.com,,,http://commons.wikimedia.org/wiki/Special:FilePath/Google%2B%20logo.png,,http://commons.wikimedia.org/wiki/Special:FilePath/Google%2B%20logo.svg,,EN,FR,ES,DE,,,,,,,,,,,,,,,,,,,,,,,,,Web,Android,iOS,,,,,,,,,,,https://support.google.com/plus/,https://www.google.com/policies/terms/,https://www.google.com/policies/privacy/,Free,https://en.wikipedia.org/wiki/Google%2B,,http://www.wikidata.org/entity/Q356,,,,,,
Hangouts,,,Discussion,Communication,Chat,Voice,Call,,,,,,,,,,,,,,,Google Inc.,,,,,,,,,,,,,,,,,,,,,,,EN,FR,ES,DE,,,,,,,,,,,,,,,,,,,,,,,,,Web,,,,,,,,,,,,,https://support.google.com/hangouts/,https://www.google.com/policies/terms/,https://www.google.com/policies/privacy/,,,,,,,,,,
NationBuilder,NationBuilder is a unique nonpartisan community organizing system that brings together a comprehensive suite of tools that today's leaders and creators need to gather their tribes.,,Bulk messaging,Campaign,Campaign management,Campaign organizing platforms,Communication,Community organizing,Content management system,Content management system (CMS),Customer relationship management (CRM),Dashboard,Data mining,Donation,Engagement,Event planning,Fundraising,Pol-Tech,Visualization,-business enterprise,-VoIP software,3dna,,,,,,,,,,,,,,,2009,http://nationbuilder.com/,,https://3dna.nationbuilder.com/create,http://d3n8a8pro7vhmx.cloudfront.net/themes/54f4fb8d2213932df8000001/attachments/original/1464118133/nationbuider-logo.svg?1464118133,,,,EN,,,,,,,,,,,,,,,,,,,,,,,,,,,,Web,,,,,,,http://www.twitter.com/nationbuilder,http://www.facebook.com/groups/nationbuilder/,https://www.youtube.com/user/nationbuilder,,,,http://nationbuilder.com/support,http://nationbuilder.com/tos,http://nationbuilder.com/privacy,Pay as you grow,,,http://www.wikidata.org/entity/Q17137639,,,,,,
NGP VAN,"NGP VAN is the leading technology provider to Democratic and progressive campaigns and organizations, offering clients an integrated platform of the best fundraising, compliance, field, organizing, digital, and social networking products.",,Campaign organizing platforms,Campaign management,Dashboard,Data mining,Visualization,Customer relationship management (CRM),Engagement,Bulk messaging,Campaign,Community organizing,Event planning,Content management system (CMS),Fundraising,Communication,Pol-Tech,Donation,Suite,,,NGP VAN,,,,,,,,,,,,,,,,https://www.ngpvan.com/,,https://act.ngpvan.com/get-elected,,,,,EN,,,,,,,,,,,,,,,,,,,,,,,,,,,,Web,,,,,,,,,,,,,,,https://www.ngpvan.com/content/privacy-policy,,,,,,,,,,
Pocket,"Pocket is an innovative free app that allows you to make clippings from the web to read later. Put articles, videos or pretty much anything into Pocket. Save directly from your browser or from apps like Twitter, Flipboard, Pulse and Zite. If it's in Pocket, it's on your phone, tablet or computer. You don't even need an Internet connection.",Pocket est une application qui permet de gérer une liste d'articles lus sur Internet.,Reading,Media,Plug-in,Offline,Reader,Saving,Text,Bookmarking,,,,,,,,,,,,"Read It Later, Inc.",,,,,,,,,,,,,,,2007,https://getpocket.com/,,,,,,,EN,,,,,,,,,,,,,,,,,,,,,,,,,,,,Web,Android https://play.google.com/store/apps/details?id=com.ideashower.readitlater.pro,iOS https://itunes.apple.com/app/read-it-later-pro/id309601447?mt=8,MacOS https://itunes.apple.com/app/pocket/id568494494?ls=1&mt=12,,,,https://twitter.com/pocket,https://facebook.com/getpocket,,,,,https://help.getpocket.com/,https://getpocket.com/tos,https://getpocket.com/privacy,Freemium,https://en.wikipedia.org/wiki/Pocket_(application),,,,,,,,
Politizr,Politizr est une plateforme indépendante et neutre permettant aux élu-e-s de débattre publiquement des sujets proposés par leurs concitoyen-ne-s.,,Pol-tech,Debate,Political,Q&A,Engagement,,,,,,,,,,,,,,,Politizr s.a.s,,,,,,,,,,,,,,,2015,https://www.politizr.com/,contact@politizr.com,,,,,,,,,,,,,,,,,,,,,,,,,,,,,,,,,,Web,,,,,,,https://twitter.com/Politizr,https://www.facebook.com/Politizr,,,,,http://politizr.help/,?,,,,,,,,,,,
Slack,A cloud-based team collaboration tool,,Chat,Collaboration,Group communication tools,-application,-business enterprise,-website,Discussion,Cloud,Online service,,,,,,,,,,,Slack Technologies,,,,,,,,,,,,,,,2013-08-01T00:00:00Z,http://slack.com,,,,,,,EN,,,,,,,,,,,,,,,,,,,,,,,,,,,,Web,Windows,Android,,,,,,,,,,,slack.com/help,https://slack.com/terms-of-service,https://slack.com/privacy-policy,"Free plan, commercial plans. https://slack.com/pricing",https://en.wikipedia.org/wiki/Slack%20%28software%29,,http://www.wikidata.org/entity/Q17130715,,,,,,
Trello,"Trello is a collaboration tool that organizes your projects into boards. In one glance, Trello tells you what's being worked on, who's working on what, and where something is in a process….Trello lets you organize anything easily, from life goals and to-do lists to group projects. [You can] add images, checklists, due dates, attachments, and more to your Trello board. [And] team projects are where Trello really shines: improve communication, eliminate email traffic, and get everyone on the same page—fast.",Trello est un outil de gestion de projet en ligne.,Campaign organizing platforms,Project Management,Kanban,Management,Board,Collaborative,Online service,Cloud,,,,,,,,,,,,"Trello, Inc.",,,,,,,,,,,,,,,2011,https://trello.com/,,https://trello.com/b/KaRKUPfD/demo-project,,,,,EN,FR,ES,DE,PT,FI,NB,SV,RU,PL,HU,UK,CS,NL,IT,TR,TH,JA,ZH,VI,,,,,,,,,Web,Android https://play.google.com/store/apps/details?id=com.trello,iOS https://itunes.apple.com/app/trello-organize-anything/id461504587,,,,,http://twitter.com/trello,http://www.facebook.com/trelloapp,,,,,http://help.trello.com/,https://trello.com/legal,https://trello.com/privacy,Freemium,https://en.wikipedia.org/wiki/Trello,,,,,,,,
Demodyne,"Online nonprofit platform for participatory & direct democracy, citizen collaboration and budget transparency. Community with decentralized governance.","Demodyne est une plateforme en ligne à but non lucratif, dont le but est d'optimiser la prise de décision collaborative et la coordination des actions dans une communauté. Elle est pensée pour devenir à terme un outil complet pour mettre en pratique une démocratie participative efficace dans chaque ville, région, état et pays du monde.",Decision making,Proposition,Engagement,Co-construction,Collaborative,Choose a program,Voting,Budget,Public spending,Political candidacy,Project management,,,,,,,,,Direct Governance Initiative,,,,,,,,,,,,,,,,https://demodyne.org/,contact@demodyne.org,,,,,,FR,EN,RO,,,,,,,,,,,,,,,,,,,,,,,,,,Web,,,,,,,https://twitter.com/demodyne,https://www.facebook.com/demodyne/,,https://vimeo.com/demodyne,,http://forum.demodyne.org/,https://www.demodyne.org/pages/help,https://forum.demodyne.org/showthread.php?tid=4,,"Free plan, commercial plans. https://slack.com/pricing",,,,,,,,,
Hackpad,Collaborative Real-Time Text Editor (now owned by Dropbox),,-Collaborative document writing,-General Purpose,Proposal Making,-free software,text editor,Document,Editor,Collaborative,Real-time,Text,Online service,Cloud,,,,,,,,"Dropbox, Inc.",,,,,,,,,,,,,,,,https://hackpad.com/,,,,,,,EN,,,,,,,,,,,,,,,,,,,,,,,,,,,,Web,,,,,,,,,,,,,https://hackpad.com/How-to-use-Hackpad-mlZvEsJykI5,https://hackpad.com/static/tos.html,https://hackpad.com/Hackpad-Privacy-Policy-RpTWPko6ER2,Free,https://en.wikipedia.org/wiki/Hackpad,,http://www.wikidata.org/entity/Q18347914,,,,,,
Padlet,Padlet is the easiest way to create and collaborate in the world,,Board,Project management,Brainstorming,Real-time,Ideation,Task,Note-taking,Collaborative,Post-it,Timeline,To-do list,Link,Sharing,Voice recoding,Photo,Document,,,,"Padletwisher, Inc.",,,,,,,,,,,,,,,,https://padlet.com/,hello@padlet.com,,,,,,EN,AR,CS,CY,DA,DE,EL,EN,ES,FI,TL,FR,GL,HE,ID,IT,JA,KO,MS,NL,NB,PL,PT,RU,SV,TR,VI,ZH,Web,Android https://play.google.com/store/apps/details?id=com.wallwisher.Padlet,iOS https://itunes.apple.com/us/app/padlet/id834618886?ls=1&mt=8,,,,,http://twitter.com/padlet,http://facebook.com/wallwisher,,,,,,http://sl.padlet.com/terms,http://jn.padlet.com/article/32-privacy-policy,"Free plan, commercial plans. https://padlet.com/premium",,,,,,,,,
Meetup,"Meetup is the world's largest network of local groups. Meetup makes it easy for anyone to organize a local group or find one of the thousands already meeting up face-to-face. More than 9,000 groups get together in local communities each day, each one with the goal of improving themselves or their communities.","Meetup est le plus grand réseau mondial de rencontres amicales. Meetup facilite l'organisation de rencontres en personne dans les villes et permet à tous d'ouvrir un groupe ou de rejoindre une communauté existante. Plus de 9 000 groupes se rencontrent chaque jour, chacun dans le but d'améliorer la vie quotidienne de leurs membres. ",Conference Management,Event organizing,Management,Planning,Events,Ticketing,Ticket saling,Workshop,Registration,Meeting,Booking,Campaign,Community,Organization,Engagement,Social networking,,,,Meetup Inc.,,,,,,,,,,,,,,,,https://www.meetup.com/,,,,,,,EN,FR,ES,DE,,,,,,,,,,,,,,,,,,,,,,,,,Web,Android https://play.google.com/store/apps/details?id=com.meetup,iOS https://itunes.apple.com/us/app/meetup-groups-near-you-that/id375990038,,,,,https://twitter.com/meetup,https://www.facebook.com/meetup,,https://vimeo.com/user32716642,,,https://www.meetup.com/en-US/help/,https://www.meetup.com/en-US/terms/,https://www.meetup.com/en-US/privacy/,,,,,,,,,,
Stig,,,Decision making,,,,,,,,,,,,,,,,,,,Stig SAS,,,,,,,,,,,,,,,,https://getstig.org/,contact@getstig.org,,,,,,FR,,,,,,,,,,,,,,,,,,,,,,,,,,,,Web https://getstig.org/app/,,,,,,,https://twitter.com/getstig,https://www.facebook.com/getstig,https://www.youtube.com/channel/UCL7REHRPv24xRCV-kC0n2JA/,,,,,,https://getstig.org/ptdp/,,,,,,,,,,
Cuttlefish,Transactional email server with a lovely web interface ,,Messaging,Email,Server,,,,,,,,,,,,,,,,,OpenAustralia Foundation,,,,,Cuttlefish,,,,,,,,,,,https://cuttlefish.oaf.org.au/,,,,,,,,,,,,,,,,,,,,,,,,,,,,,,,,,,,Web,,,,,,,,,,,,,,,,,,,,,,,,,
Datea,"Datea is a corwdsourcing and civic engagement platform to create and visualize citizen reports (dateos) in maps, picture galleries, timelines and charts. It's mail goal is to allow citizens to share and visualize useful information for any purpose. It's flexibel, hashtag based structure allows anyone to create a map, timeline or gallery just by creating a report (dateo) using a hashtag. Furthermore, report iniciatives can be created by organizations such as NGOs, local governments and activists, which allow them to campaign for certain issues in order to obtain useful information from citizens (dateros).",,-CivicTech,Mapping,Open Data,-Open data,Reporting,-Crowdsourced data collection,Collaborative,Crowdmapping,Engagement,Crowdsourcing,,,,,,,,,,La Factura SAC,,,,,Datea,,,,,,,,,,,http://www.datea.pe,,,,,,,ES,FR,,,,,,,,,,,,,,,,,,,,,,,,,,,Web,Android https://play.google.com/store/apps/details?id=pe.datea.mobile2,iOS https://itunes.apple.com/us/app/datea/id590511022?ls=1&mt=8,,,,,http://twitter.com/somosdateros,https://www.facebook.com/somosdateros,,,,,http://ayuda.datea.pe/,http://datea.pe/acerca/terminos,http://datea.pe/acerca/privacidad,"FOSS, commercial customization",,,,,,,,,
